{
  "schemaVersion":"operations-exercise-family.v1",
  "id":"OPS-EX-FAMILY-D04-M01",
  "moduleId":"OPS-D04-M01",
  "version":"1.0",
  "variantPolicy":"Seeded variants alter event ordering, missing fields, and privacy flags; they are not independent published assets.",
  "variantDimensions":{"eventOrdering":["ordered","ingestion-delay","clock-skew"],"contextQuality":["complete","missing-correlation","duplicate-retry"],"privacyState":["safe","credential-leak","business-identifier"]},
  "exercises":[
    {"id":"OPS-EX-D04-M01-001","moduleId":"OPS-D04-M01","version":"1.0","title":"Specify a Privacy-Safe Commerce Event Contract","type":"structured-logging-design","difficulty":"guided-administration","estimatedMinutes":45,"competencyIds":["OPS-OBS-006"],"objective":"Design a versioned event contract that supports diagnosis without exposing sensitive payloads.","initialState":"A custom checkout extension emits free-text messages and a full request body on failures.","prompt":"Define the event envelope, allowed dimensions, protected fields, redaction behavior, versioning rule, and unit/negative tests for checkout success, timeout, retry, and exception paths.","constraints":["do not log credentials or payment payloads","use UTC","separate request correlation from business reference","include simulation/runtime boundary"],"deliverable":"Event schema, redaction table, and executable test plan.","acceptanceCriteria":["schema version and outcome are explicit","correlation and business reference are distinct","sensitive fields are excluded or tokenized","normal and nested exception paths are tested","runtime integration evidence is identified"],"hints":[{"level":1,"text":"Begin with the questions an operator must answer."},{"level":2,"text":"A business ID is not automatically safe as a trace key."}],"evaluation":{"conceptGroups":[["schema","version","outcome"],["correlation","trace","business"],["redact","credential","payment"],["exception","retry","negative"],["runtime","integration","evidence"]],"hardFailPhrases":["log the authorization header","log the full payment payload"],"weights":{"criteriaCoverage":0.5,"safety":0.25,"runtimeBoundary":0.25},"passThreshold":0.8},"referenceSolution":"Use a versioned JSON envelope with UTC event time, environment/aspect/service/operation/outcome, generated correlation/trace IDs, minimized business token, duration, error class and release. Exclude credentials and payloads; test serializer, redaction, retry, missing context, nested exception, and target-runtime forwarding.","sourceIds":["RS-SAP-PLATFORM-LOGGING","RS-SAP-ENV-LOGS"],"reviewStatus":"implemented-machine-validated"},
    {"id":"OPS-EX-D04-M01-002","moduleId":"OPS-D04-M01","version":"1.0","title":"Reconstruct a Delayed OpenSearch Timeline","type":"log-investigation","difficulty":"independent-production-operation","estimatedMinutes":50,"competencyIds":["OPS-OBS-004","OPS-OBS-006"],"objective":"Investigate delayed and contradictory records without claiming causality from dashboard order.","initialState":"A simulated bundle contains access, application, deployment, retry, and business-state records with event/ingestion delay.","prompt":"Write and execute a bounded query plan, select control samples, construct the UTC timeline, rank hypotheses, and list evidence that would falsify the leading explanation.","constraints":["record tenant and query context","preserve original identifiers","do not use customer email as correlation","label simulation evidence"],"deliverable":"Investigation record, timeline, hypothesis table, and verification plan.","acceptanceCriteria":["window and environment are bounded","event and ingestion time are distinguished","success and failure controls are included","business state is independently checked","unknowns and falsifiers are explicit"],"hints":[{"level":1,"text":"Start with impact and the smallest reliable time window."},{"level":2,"text":"An empty result has several possible explanations."}],"evaluation":{"conceptGroups":[["window","utc","environment"],["event","ingestion","ordering"],["control","success","failure"],["hypothesis","falsify","unknown"],["business","state","verify"]],"hardFailPhrases":["same minute proves cause","no log means no request"],"weights":{"criteriaCoverage":0.5,"safety":0.2,"uncertainty":0.15,"verificationEvidence":0.15},"passThreshold":0.8},"referenceSolution":"Bound the environment and UTC window, identify tenant and documented origin/aspect filters, preserve event and ingestion times, choose representative control records, correlate by generated identifiers, and validate the business state separately from the request result.","sourceIds":["RS-SAP-ENV-LOGS","RS-SAP-HELP-AUDIT"],"reviewStatus":"implemented-machine-validated"},
    {"id":"OPS-EX-D04-M01-003","moduleId":"OPS-D04-M01","version":"1.0","title":"Test a Defective Correlation Propagator","type":"testing-and-fault-injection","difficulty":"advanced-reliability-engineering","estimatedMinutes":65,"competencyIds":["OPS-OBS-006"],"objective":"Diagnose and correct context loss across retry, asynchronous processing, and failure paths.","initialState":"A simulated logger preserves correlation on success but drops it on retry and emits an unredacted exception field after cancellation.","prompt":"Create a test matrix and correction proposal covering synchronous request, retry, CronJob trigger, cancellation, duplicate execution, malformed event, and nested exception paths.","constraints":["unit tests are not platform proof","include target update-line integration evidence","assert no unsafe action is required"],"deliverable":"Defect diagnosis, tests, correction, and evidence manifest.","acceptanceCriteria":["each path has an observable assertion","retry and async context are covered","redaction is verified after exception wrapping","duplicate execution is distinguishable","platform boundary is recorded"],"hints":[{"level":1,"text":"Test the context at every boundary, not only at the controller."},{"level":2,"text":"Cancellation often takes a different exception path."}],"evaluation":{"conceptGroups":[["sync","retry","async"],["cronjob","cancel","duplicate"],["redact","nested","exception"],["assert","matrix","negative"],["platform","integration","boundary"]],"hardFailPhrases":["the code compiles so it is done","unit test proves Cloud Portal forwarding"],"weights":{"criteriaCoverage":0.5,"safety":0.2,"runtimeBoundary":0.3},"passThreshold":0.8},"referenceSolution":"Instrument a single safe context object, propagate a generated correlation/trace token through retry and async trigger, use a minimized business token, and assert normal, rejection, retry, cancellation, duplicate, malformed, and nested exception paths. Execute platform forwarding tests only in a configured target runtime and label local tests as simulation/unit evidence.","sourceIds":["RS-SAP-TESTING-JUNIT5","RS-SAP-TESTING-EXECUTION","RS-SAP-CRONJOB-ASPECTS"],"reviewStatus":"implemented-machine-validated"}
  ]
}
