{
  "schemaVersion":"operations-exercise-family.v1",
  "id":"OPS-EX-FAMILY-D04-M02",
  "moduleId":"OPS-D04-M02",
  "version":"1.0",
  "variantPolicy":"Seeded variants alter tenant, ingestion delay, aspect, and missing-field conditions; variants are replay aids and not independent published assets.",
  "variantDimensions":{"tenant":["global","private"],"ingestionDelayMinutes":[0,4,12],"eventQuality":["complete","missing-correlation","duplicate-retry"]},
  "exercises":[
    {"id":"OPS-EX-D04-M02-001","moduleId":"OPS-D04-M02","version":"1.0","title":"Build a Reproducible OpenSearch Query Plan","type":"open-search-investigation","difficulty":"guided-administration","estimatedMinutes":45,"competencyIds":["OPS-OBS-004"],"objective":"Investigate a synthetic storefront outage without broad or irreproducible searches.","initialState":"The evidence bundle contains access, application, Catalina, deployment, and business-state records with delayed ingestion.","prompt":"Produce the query sequence, control samples, evidence manifest, privacy treatment, and falsification tests for the supplied tenant and UTC window.","constraints":["use documented filter categories","record exact query context","do not treat empty results as proof","label synthetic evidence"],"deliverable":"Versioned investigation record and handoff.","acceptanceCriteria":["impact and UTC window bounded","tenant/aspect/origin recorded","success and failure samples selected","event and ingestion time separated","unknowns and falsifiers explicit","sensitive data minimized"],"hints":[{"level":1,"text":"Start with the decision the query must inform."},{"level":2,"text":"A known-good control can distinguish no traffic from a bad filter."}],"evaluation":{"conceptGroups":[["impact","utc","window"],["tenant","aspect","origin"],["control","success","failure"],["event","ingestion","delay"],["unknown","falsify","hypothesis"],["redact","privacy","minimize"]],"hardFailPhrases":["export every tenant","customer email as correlation"],"weights":{"criteriaCoverage":0.5,"safety":0.25,"verificationEvidence":0.25},"passThreshold":0.8},"referenceSolution":"Bound the window and environment, record tenant and documented filters, obtain representative control records, preserve source IDs and timestamps, distinguish ingestion delay, minimize sensitive data, and state the next falsification query.","sourceIds":["RS-SAP-ENV-LOGS","RS-SAP-PLATFORM-LOGGING"],"reviewStatus":"implemented-machine-validated"},
    {"id":"OPS-EX-D04-M02-002","moduleId":"OPS-D04-M02","version":"1.0","title":"Reconcile Contradictory Search and Business Evidence","type":"evidence-reconciliation","difficulty":"independent-production-operation","estimatedMinutes":50,"competencyIds":["OPS-OBS-004"],"objective":"Separate request outcome, application outcome, and business outcome during an ambiguous order incident.","initialState":"Synthetic access and application records report success while payment and order state remain unresolved.","prompt":"Construct the evidence layers, identify the safe operational state, assign reconciliation ownership, and define closure checks.","constraints":["no duplicate side effect","protect payment data","do not close on HTTP status alone","simulation is not live payment execution"],"deliverable":"Layered evidence table, reconciliation procedure, and closure checklist.","acceptanceCriteria":["technical and business layers separated","correlation preserved","ambiguous records protected","idempotent reconciliation proposed","owner and verification window named"],"hints":[{"level":1,"text":"Ask what each record actually proves."},{"level":2,"text":"Recovery of latency does not settle external state."}],"evaluation":{"conceptGroups":[["access","application","business"],["payment","order","ambiguous"],["correlation","idempotent","reconcile"],["owner","verify","closure"]],"hardFailPhrases":["HTTP 200 means paid","retry the payment blindly"],"weights":{"criteriaCoverage":0.55,"safety":0.25,"verificationEvidence":0.2},"passThreshold":0.8},"referenceSolution":"Keep the incident open for unresolved business state, preserve IDs, reconcile under idempotency and authorization, assign an owner, verify technical and business recovery separately, and retain the synthetic boundary.","sourceIds":["RS-SAP-ENV-LOGS","RS-SAP-DYNATRACE-STOREFRONT"],"reviewStatus":"implemented-machine-validated"},
    {"id":"OPS-EX-D04-M02-003","moduleId":"OPS-D04-M02","version":"1.0","title":"Test a Logging Runbook Before Production Use","type":"operational-test-development","difficulty":"advanced-reliability-engineering","estimatedMinutes":60,"competencyIds":["OPS-OBS-005","OPS-OBS-006"],"objective":"Create failure-path tests that prevent a logging runbook from creating false confidence.","initialState":"A draft runbook searches one fixed field and assumes dashboard order equals event order.","prompt":"Design deterministic fixtures, assertions, provider/runtime checks, and evidence requirements for the runbook.","constraints":["include missing-field and delayed-ingestion cases","include privacy failure","distinguish local simulation from SAP runtime","no managed-index mutation"],"deliverable":"Test matrix, corrected runbook gates, and execution evidence manifest.","acceptanceCriteria":["wrong timezone tested","field mapping and empty result ambiguity tested","duplicate/clock-skew cases tested","sensitive export blocked","second-operator replay specified","target-runtime checks separated"],"hints":[{"level":1,"text":"Attack every assumption the draft makes."},{"level":2,"text":"The runbook is part of the system and needs regression evidence."}],"evaluation":{"conceptGroups":[["timezone","window","utc"],["mapping","empty","retention"],["duplicate","clock","ingestion"],["privacy","export","redact"],["replay","operator","evidence"],["runtime","simulation","boundary"]],"hardFailPhrases":["dashboard order is truth","change the managed index"],"weights":{"criteriaCoverage":0.5,"safety":0.25,"runtimeBoundary":0.25},"passThreshold":0.8},"referenceSolution":"Add deterministic fixtures for query and evidence failure modes, require privacy-safe bounded packages, replay the runbook by another operator, and execute platform forwarding/permission checks only against the selected supported runtime.","sourceIds":["RS-SAP-ENV-LOGS","RS-SAP-TESTING-EXECUTION","RS-SAP-TESTING-JUNIT5"],"reviewStatus":"implemented-machine-validated"}
  ]
}
