{
  "schemaVersion":"operations-exercise-family.v1",
  "id":"OPS-EX-FAMILY-D04-M04",
  "moduleId":"OPS-D04-M04",
  "version":"1.0",
  "variantPolicy":"Seeded variants alter traffic, telemetry freshness, dependency delay, and business ambiguity; variants are replay aids and not independent published assets.",
  "variantDimensions":{"traffic":["normal","zero","flash-sale"],"telemetry":["fresh","delayed","partial"],"businessState":["consistent","ambiguous"]},
  "exercises":[
    {"id":"OPS-EX-D04-M04-001","moduleId":"OPS-D04-M04","version":"1.0","title":"Design a Journey-Centered Health Dashboard","type":"dashboard-design","difficulty":"guided-administration","estimatedMinutes":50,"competencyIds":["OPS-OBS-005"],"objective":"Create overview and diagnostic panels that support safe checkout decisions.","initialState":"Synthetic traffic, success, latency, pool, JVM, dependency, deployment, and payment-state fixtures are available.","prompt":"Define panel contracts, units, aggregations, freshness, owners, privacy, runbook links, and unknown states.","constraints":["no universal thresholds","no customer identifiers","separate simulation from target runtime","include business verification"],"deliverable":"Dashboard specification and acceptance test matrix.","acceptanceCriteria":["journey denominator defined","tail latency and errors included","technical diagnostic path linked","missing telemetry is unknown","change and dependency context included","privacy/cardinality reviewed"],"hints":[{"level":1,"text":"Start with the operational decision, not the metric catalog."},{"level":2,"text":"A panel needs a freshness and failure behavior."}],"evaluation":{"conceptGroups":[["journey","success","denominator"],["latency","error","traffic"],["pool","jvm","dependency"],["freshness","unknown","missing"],["change","release","deployment"],["privacy","cardinality","owner"]],"hardFailPhrases":["email as dashboard dimension","one threshold fits all"],"weights":{"criteriaCoverage":0.5,"safety":0.25,"verificationEvidence":0.25},"passThreshold":0.8},"referenceSolution":"Use business success and eligible denominator on the overview, tail latency/error/traffic, resource and dependency panels for diagnosis, release markers, freshness/unknown state, privacy-safe dimensions, owners, and synthetic/target-runtime acceptance tests.","sourceIds":["RS-SAP-DYNATRACE","RS-SAP-DYNATRACE-TROUBLESHOOT"],"reviewStatus":"implemented-machine-validated"},
    {"id":"OPS-EX-D04-M04-002","moduleId":"OPS-D04-M04","version":"1.0","title":"Diagnose JVM Versus Pool Saturation","type":"metric-correlation","difficulty":"independent-production-operation","estimatedMinutes":45,"competencyIds":["OPS-PERF-004"],"objective":"Rank competing performance hypotheses from a shared timeline.","initialState":"Synthetic metrics show checkout p95, success, pool wait, heap, GC, CPU, worker use, and database contribution across a release window.","prompt":"Produce a causal timeline, leading hypothesis, rejected alternatives, verification checks, and safe containment recommendation.","constraints":["do not infer from one metric","preserve business ambiguity","no direct database action","simulation only"],"deliverable":"Evidence table and incident decision record.","acceptanceCriteria":["leading signal identified","JVM alternative tested","pool/database path connected","customer impact quantified","safe action and verification named"],"hints":[{"level":1,"text":"Compare which signal changes first."},{"level":2,"text":"Pair resource evidence with the affected journey."}],"evaluation":{"conceptGroups":[["timeline","leading","signal"],["heap","gc","cpu"],["pool","wait","database"],["checkout","success","impact"],["contain","verify","safe"]],"hardFailPhrases":["restart everything","increase the pool first"],"weights":{"criteriaCoverage":0.55,"safety":0.25,"verificationEvidence":0.2},"passThreshold":0.8},"referenceSolution":"Align windows, show pool wait preceding checkout tail latency, use trace/database contribution, reject JVM pressure if its indicators remain baseline, contain the bounded workload if permitted, and verify sustained technical and business recovery.","sourceIds":["RS-SAP-DYNATRACE-DB-POOL","RS-SAP-DYNATRACE-STOREFRONT","RS-SAP-DYNATRACE-PUREPATH"],"reviewStatus":"implemented-machine-validated"},
    {"id":"OPS-EX-D04-M04-003","moduleId":"OPS-D04-M04","version":"1.0","title":"Fault-Inject a False-Green Dashboard","type":"observability-testing","difficulty":"advanced-reliability-engineering","estimatedMinutes":55,"competencyIds":["OPS-OBS-005","OPS-OBS-006"],"objective":"Test dashboard behavior under missing and misleading telemetry.","initialState":"A synthetic dashboard fills missing series with zero and marks zero traffic healthy.","prompt":"Define fault injections, expected panel states, alert interactions, and recovery evidence for zero traffic, stale metrics, partial permissions, delayed ingestion, dependency outage, and ambiguous payment state.","constraints":["unknown is not zero","no raw payment data","include release comparison","record simulation boundary"],"deliverable":"Fault-injection suite and corrected dashboard contract.","acceptanceCriteria":["every fault has expected unknown/degraded state","business success is independently checked","privacy assertions exist","release and dependency context retained","replay evidence is recorded"],"hints":[{"level":1,"text":"Test data absence separately from data value zero."},{"level":2,"text":"A healthy-looking panel can be a telemetry failure."}],"evaluation":{"conceptGroups":[["zero","traffic","denominator"],["stale","delayed","freshness"],["permission","partial","unknown"],["dependency","business","payment"],["privacy","release","replay"]],"hardFailPhrases":["missing data equals healthy","include payment payload"],"weights":{"criteriaCoverage":0.5,"safety":0.2,"testDesign":0.3},"passThreshold":0.8},"referenceSolution":"Represent missing, stale, and unauthorized data as unknown/degraded; test zero traffic and denominator changes; preserve privacy; require synthetic or business verification; retain release/dependency context and deterministic replay evidence.","sourceIds":["RS-SAP-DYNATRACE-TROUBLESHOOT","RS-SAP-TESTING-EXECUTION"],"reviewStatus":"implemented-machine-validated"}
  ]
}
