{
  "schemaVersion":"operations-exercise-family.v1",
  "id":"OPS-EX-FAMILY-D04-M05",
  "moduleId":"OPS-D04-M05",
  "version":"1.0",
  "variantPolicy":"Seeded variants alter denominator, workload, telemetry freshness, and business ambiguity; variants are replay aids and not independent published assets.",
  "variantDimensions":{"workload":["normal","flash-sale","batch-overlap"],"telemetry":["fresh","delayed","missing"],"impact":["technical-only","checkout","ambiguous-payment"]},
  "exercises":[
    {"id":"OPS-EX-D04-M05-001","moduleId":"OPS-D04-M05","version":"1.0","title":"Write an Actionable Checkout Alert Contract","type":"alert-engineering","difficulty":"guided-administration","estimatedMinutes":50,"competencyIds":["OPS-OBS-005"],"objective":"Create a customer-impact alert with evidence, ownership, and safe closure.","initialState":"Synthetic checkout success, latency, traffic, pool, dependency, deployment, and payment fixtures are available.","prompt":"Define signal, denominator, windows, corroboration, severity, deduplication, maintenance, evidence package, runbook, escalation, and resolution.","constraints":["no universal threshold","no sensitive alert labels","telemetry loss is not green","include business verification"],"deliverable":"Versioned alert contract and test matrix.","acceptanceCriteria":["business impact defined","multi-signal context attached","owner and severity named","maintenance expiry tested","privacy-safe key","technical and business closure"],"hints":[{"level":1,"text":"Page on impact and diagnose with context."},{"level":2,"text":"Define what happens when the provider is stale."}],"evaluation":{"conceptGroups":[["impact","success","denominator"],["window","threshold","baseline"],["corroborate","pool","dependency"],["owner","severity","runbook"],["deduplicate","maintenance","expiry"],["privacy","key","redact"],["verify","business","closure"]],"hardFailPhrases":["email as alert key","suppress every deployment","missing data is healthy"],"weights":{"criteriaCoverage":0.5,"safety":0.25,"verificationEvidence":0.25},"passThreshold":0.8},"referenceSolution":"Use a business success signal and valid denominator with workload-aware windows, resource/dependency context, named owner/severity/runbook, bounded privacy-safe incident key, explicit maintenance expiry, telemetry-degraded behavior, and separate technical/business recovery checks.","sourceIds":["RS-SAP-DYNATRACE","RS-SAP-DYNATRACE-TROUBLESHOOT","RS-SAP-ENV-LOGS"],"reviewStatus":"implemented-machine-validated"},
    {"id":"OPS-EX-D04-M05-002","moduleId":"OPS-D04-M05","version":"1.0","title":"Lead an Alert-Fatigue Review","type":"postmortem-analysis","difficulty":"independent-production-operation","estimatedMinutes":45,"competencyIds":["OPS-OBS-005","OPS-INC-004"],"objective":"Turn noisy or late alerts into measured reliability improvements.","initialState":"Synthetic history shows duplicate pages, false positives during maintenance, one late checkout impact, and missing business context.","prompt":"Analyze detection and response quality, propose policy changes, define tests and owners, and preserve residual risk.","constraints":["no person as root cause","no blanket threshold increase","measure effectiveness","simulation only"],"deliverable":"Alert review, corrective-action portfolio, and evidence plan.","acceptanceCriteria":["false positives classified","missed impact explained","business context added","dedup/suppression corrected","owners and measures assigned","residual risk explicit"],"hints":[{"level":1,"text":"Separate detection failure from response toil."},{"level":2,"text":"Measure whether a new rule improves decisions."}],"evaluation":{"conceptGroups":[["false","positive","duplicate"],["late","impact","detection"],["business","context","denominator"],["dedup","maintenance","suppression"],["owner","measure","risk"]],"hardFailPhrases":["increase the threshold only","blame the operator"],"weights":{"criteriaCoverage":0.5,"safety":0.2,"improvement":0.3},"passThreshold":0.8},"referenceSolution":"Classify noise and missed impact, add business SLIs and corroborating context, correct deduplication and maintenance expiry, test provider and runbook behavior, assign measurable owners, and retain residual risk.","sourceIds":["RS-SAP-DYNATRACE","RS-SAP-DYNATRACE-TROUBLESHOOT","RS-SAP-TESTING-EXECUTION"],"reviewStatus":"implemented-machine-validated"},
    {"id":"OPS-EX-D04-M05-003","moduleId":"OPS-D04-M05","version":"1.0","title":"Fault-Inject Alert Delivery and Closure","type":"alert-testing-and-recovery","difficulty":"advanced-reliability-engineering","estimatedMinutes":60,"competencyIds":["OPS-OBS-005","OPS-OBS-006"],"objective":"Verify alert safety when signals, delivery, and business state disagree.","initialState":"A deterministic alert engine receives normal, impact, telemetry-loss, duplicate, deployment, and ambiguous-payment fixtures.","prompt":"Define fault injections, expected alert states, evidence retention, routing fallback, resolution checks, and runtime execution boundary.","constraints":["no destructive real action","no sensitive notification payload","provider/runtime checks explicit","unsafe recovery fails"],"deliverable":"Fault-injection suite and release gate.","acceptanceCriteria":["impact pages","telemetry loss is visible","duplicates deduplicate","maintenance expires","routing failure has fallback","ambiguous state blocks closure","privacy assertions exist"],"hints":[{"level":1,"text":"Test alert lifecycle, not only trigger."},{"level":2,"text":"Resolution needs business evidence for ambiguous outcomes."}],"evaluation":{"conceptGroups":[["impact","page","severity"],["telemetry","missing","degraded"],["duplicate","deduplicate","incident"],["maintenance","expiry","release"],["routing","fallback","delivery"],["ambiguous","business","closure"],["privacy","notification","redact"]],"hardFailPhrases":["close when latency drops","send payment payload"],"weights":{"criteriaCoverage":0.5,"safety":0.25,"runtimeBoundary":0.25},"passThreshold":0.8},"referenceSolution":"Inject impact and non-impact fixtures, require visible degraded telemetry, group only the same incident, test maintenance expiry and alternate delivery, block closure on ambiguous business state, and verify privacy and target-provider boundaries.","sourceIds":["RS-SAP-ENV-LOGS","RS-SAP-DYNATRACE-TROUBLESHOOT","RS-SAP-TESTING-EXECUTION"],"reviewStatus":"implemented-machine-validated"}
  ]
}
